{"task_id":"meeting","policy_id":"p1","schema_version":"0.1","run_id":"baseline","input":{},"sources":[],"claims":[],"claim_relations":[],"evidence":[],"assumptions":[],"contradictions":[],"failure_modes":[],"verification_options":[],"minimum_verification_set":{"selected_verification_ids":[],"covered_failure_ids":[],"covered_claim_ids":[],"status":"exact","objective":"none"},"reliance_envelope":{"claim_statuses":{},"conditions":[],"prohibited_reliance":[]},"human_verification_burden":{"level":1,"label":"GLANCE","rationale":"baseline"},"residual_uncertainties":[],"limitations":[],"recommended_route":"VERIFY_FIRST","created_at":"baseline"}
